{"backend":"fixture","backend_version":"1","contract_version":"paper2md-physical-document-v0.2","metadata":{"rights":"project-authored","title":"Bootstrap fixture"},"page_count":1,"pages":[{"coordinate_system":"top-left/pdf-point/y-down","elements":[{"bbox":{"height":24.0,"width":200.0,"x":72.0,"y":72.0},"element_id":"p0-text-001","kind":"text","metadata":{"font_unavailable_reason":"self-generated fixture"},"page_index":0,"provenance":{"backend":"fixture","confidence":1.0,"method":"self_generated","source_ref":"fixture:page:0:text:0","unavailable_reason":null},"source_object_id":null,"text":"Café α bootstrap"}],"height":792.0,"page_index":0,"rotation":0,"width":612.0}],"source_sha256":"6aa98e5f86ea8e18aa7ce022274714cf52582a805376f5037d5cd0a594af088e"}
